,prod_name,HS6,Balance_mean,q,co_quantity
353,"Catalysts, supported: reaction initiators, reaction accelerators and catalytic preparations, with precious metal or precious metal compounds as the active substance, n.e.c. or included",381512,0.001622529,3518.1600000000003,5.70831662664
354,Textile machinery: involved in textile fibre or textile yarn preparation and n.e.c. in heading no. 8445,844590,0.000340628,2320.828,0.790538999984
355,"Machine-tools: flat-surface grinding machines, numerically controlled",846012,0.001167267,3980.512,4.646320300704001
356,"Vehicles: public transport type (carries 10 or more persons, including driver), with both compression-ignition internal combustion piston engine (diesel or semi-diesel) and electric motor for propulsion, new or used",870220,1.38e-05,3948.9230000000002,0.054495137400000004
357,"Vehicles: public transport type (carries 10 or more persons, including driver), with both compression-ignition internal combustion piston engine (diesel or semi-diesel) and electric motor for propulsion, new or used",870230,1.39e-05,41.814,0.0005812146
358,Cobalt: waste and scrap,810530,0.260813758,435.649,113.62325285894201
359,Slag and ash n.e.c. in chapter 26: including seaweed ash (kelp) but excluding ash and residues from the incineration of municipal waste,262190,1.08e-05,62327.839,0.6731406612
360,Hair-removing appliances: with self-contained electric motor,851030,2.38e-07,1239.575,0.00029501885
361,Centrifuges: clothes-dryers,842112,4.31e-06,812.141,0.00350032771
362,"Washing machines: household or laundry-type, not fully-automatic, without built-in centrifugal drier, of a dry linen capacity not exceeding 10kg",845019,0.001250081,2285.297,2.856806359057
363,"Turbines: steam and other vapour turbines, for marine propulsion",840610,0.138779265,58.226,8.080561483890001
364,"Pocket-watches and other watches, including stop-watches: (excluding wrist-watches), with case of precious metal or of metal clad with precious metal, electrically operated",910191,1.99e-06,4.242999999999999,8.44357e-06
365,Machine-tools: for honing or lapping,846040,0.003860954,915.624,3.5351821452960004
366,"Machine-tools: gear cutting, gear grinding or gear finishing machines, working by removing metal, sintered metal carbides or cermets",846140,0.000602635,1256.626,0.75728680951
367,"Clocks: with watch movements, electrically operated, excluding clocks of heading no. 9104",910310,2.18e-06,22.243,4.8489739999999994e-05
368,Dish washing machines: of other than household type,842219,2.74e-06,399.66200000000003,0.0010950738800000002
369,"Machines: unit construction machines (single station), for working metal",845720,0.005059464,163.063,0.8250113782319999
370,Vehicles: with only electric motor for propulsion,870380,0.004130871,4939.551,20.404647978921002
371,"Metal: catalysts in the form of wire cloth or grill, of platinum",711510,0.059368804,41.17,2.44421366068
372,Ferrous waste and scrap: n.e.c. in heading no. 7204,720449,1.07e-06,7159825.273,7.66101304211
373,"Clock movements: complete and assembled, other than electrically operated",910990,2.08e-06,4.508,9.37664e-06
374,Textile machinery: carding machines for preparing textile fibres,844511,0.001318236,1015.044,1.338067542384
375,"Catalysts, supported: reaction initiators, reaction accelerators and catalytic preparations, with nickel or nickel compounds as the active substance, n.e.c. or included",381511,0.002206681,2129.92,4.70005399552
376,"Turbines: steam and other vapour turbines, (for other than marine propulsion), of an output exceeding 40MW",840681,0.132778808,1199.105,159.21573256684
377,"Washing machines: household or laundry-type, with built-in centrifugal drier, (not fully-automatic), of a dry linen capacity not exceeding 10kg",845012,0.000492815,433.704,0.21373583676
378,Textile machinery: doubling or twisting machines,844530,0.001640953,597.224,0.980016514472
379,"Knitting machines: circular, with cylinder diameter not exceeding 165mm",844711,0.000337211,140.39600000000002,0.04734307555600001
380,Radio broadcast receivers capable of operating without an external power source: pocket-size radio cassette-players,852712,1.07e-06,12.939,1.3844729999999998e-05
381,"Printing machinery: offset, sheet-fed, office type (sheet size not exceeding 22 x 36cm in the unfolded state)",844312,1.12e-05,2813.172,0.0315075264
382,"Machine-tools: grinding machines (excluding flat-surface), centreless, numerically controlled",846022,0.001022623,67.848,0.069382925304
383,"Ferrous waste and scrap: turnings, shavings, chips, milling waste, sawdust, fillings, trimmings and stampings, whether or not in bundles",720441,3.28e-05,642722.981,21.0813137768
384,Ferrous products: remelting scrap ingots,720450,0.000598085,85092.73599999999,50.89268901056
385,"Watch movements: complete and assembled, electrically operated, with mechanical display only or with a device to which a mechanical display can be incorporated",910811,1.99e-06,2.4099999999999997,4.795899999999999e-06
386,"Machine-tools: cylindrical grinding machines (excluding flat-surface and centreless), numerically controlled",846023,0.001026906,678.103,0.6963480393179999
387,Sound recording or reproducing apparatus: telephone answering machines,851950,0.001499341,0.86,0.00128943326
388,"Calculating machines: electronic, incorporating a printing device, needing an external source of power",847021,3.79e-06,92.745,0.00035150355000000005
389,Textile machinery: drawing or roving machines for preparing textile fibres,844513,5.38e-05,159.745,0.008594281
390,"Machine-tools: shaping or slotting machines, working by removing metal, sintered metal carbides or cermets",846120,0.003003499,264.823,0.795395615677
391,Office machines: duplicating machines,847210,2.66e-06,160.739,0.00042756574
392,"Vehicles: with both compression-ignition internal combustion piston engine (diesel or semi-diesel) and electric motor for propulsion, incapable of being charged by plugging to external source of electric power",870350,0.000166116,2088.193,0.34688226838800007
393,"Slag, dross: (other than granulated slag), scalings and other waste from the manufacture of iron or steel",261900,0.005299547,280034.229,1484.0545581942629
394,"Turbines: steam and other vapour turbines, (for other than marine propulsion), of an output not exceeding 40MW",840682,0.134580669,1130.65,152.16363340485003
395,"Weaving machines (looms): for weaving fabrics of a width exceeding 30cm, shuttle type, power looms",844621,0.001724884,2720.832,4.693119583488
396,Boilers: watertube boilers with a steam production exceeding 45t per hour,840211,0.156094604,1306.045,203.86657708118
397,"Watch movements: complete and assembled, not automatic winding or electrically operated",910890,1.98e-06,2.253,4.46094e-06
398,"Machine-tools: for drilling by removing metal, numerically controlled",845921,0.011817569,611.111,7.221846409159
399,Printing machinery: gravure,844317,9.11e-06,684.898,0.006239420779999999
400,Boilers: watertube boilers with a steam production not exceeding 45t per hour,840212,0.153084469,828.357,126.80859148743299
401,Ferro-alloys: ferro-nickel,720260,0.230630767,330767.222,76285.09810831927
402,"Vehicles: public transport type (carries 10 or more persons, including driver), with only electric motor for propulsion, new or used",870240,5.95e-05,2821.148,0.167858306
403,"Vehicles: with both compression-ignition internal combustion piston engine (diesel or semi-diesel) and electric motor for propulsion, capable of being charged by plugging to external source of electric power",870370,0.000312457,392.231,0.122555321567
404,"Machine-tools: for milling by removing metal, knee-type, numerically controlled",845951,0.006598923,177.494,1.1712692389619999
405,Cobalt ores and concentrates,260500,0.036318972,2082.226,75.624307791672
406,Textile machinery: combing machines for preparing textile fibres,844512,0.007552704,141.638,1.069749889152
407,"Slag, ash and residues: (not from the manufacture of iron or steel), containing arsenic, mercury, thallium or their mixtures, of a kind used for the extraction of arsenic or those metals or for the manufacture of their chemical compounds",262060,0.022766073,1.032,0.023494587336000003
408,"Weaving machines (looms): for weaving fabrics of a width exceeding 30cm, shuttle type, other than power looms",844629,0.001877217,206.289,0.38724921771299997
409,Ferro-alloys: ferro-silico-chromium,720250,0.058353856,3534.582,206.256489048192
